<?xml version="1.0" encoding="UTF-8" standalone="no"?>
<checkpoint checkpointPath="E:\projet\BAS-CheckPoints\Checkpoint0001[2017-08-12_18-22]"
	date="2017-08-12T18:22:00" id="1" projectPath="E:\projet"
	xmlns:xs="http://www.w3.org/2001/XMLSchema-instance" 
	xs:noNamespaceSchemaLocation="com/bas/versions/xml/CheckPoint.xsd">
	
  <message>rhjdeyjr</message>
  <files>
    <file>E:\projet\BAS-CheckPoints\Checkpoint0001[2017-08-12_18-22]\Nouveau dossier\Nouveau document texte.txt</file>
    <file>E:\projet\BAS-CheckPoints\Checkpoint0001[2017-08-12_18-22]\Nouveau document texte - Copie - Copie - Copie - Copie - Copie - Copie - Copie - Copie (4) - Copie.txt</file>
    <file>E:\projet\BAS-CheckPoints\Checkpoint0001[2017-08-12_18-22]\Nouveau document texte - Copie - Copie - Copie - Copie - Copie - Copie - Copie - Copie - Copie - Copie (3).txt</file>
    <file>E:\projet\BAS-CheckPoints\Checkpoint0001[2017-08-12_18-22]\Nouveau dossier\Nouveau document texte (2).txt</file>
    <file>E:\projet\BAS-CheckPoints\Checkpoint0001[2017-08-12_18-22]\Nouveau document texte - Copie - Copie - Copie - Copie - Copie - Copie - Copie - Copie - Copie - Copie.txt</file>
    <file>E:\projet\BAS-CheckPoints\Checkpoint0001[2017-08-12_18-22]\Nouveau document texte - Copie - Copie - Copie - Copie - Copie - Copie - Copie - Copie - Copie.txt</file>
    <file>E:\projet\BAS-CheckPoints\Checkpoint0001[2017-08-12_18-22]\Nouveau document texte - Copie - Copie - Copie - Copie - Copie - Copie - Copie - Copie - Copie (3).txt</file>
  </files>
</checkpoint>
